Regne,Categorie,Code_espece,Nom_francais,Nom_latin,Nom_anglais,Nom latin,Espèces similaires,Description,Habitat,Propagation,Présence au Québec,Exercer contrôle,Feuilles,Fleurs,Fruits ou graines,Tige,Racines,Message d'alerte,Traits,Examples,img_path,is_invasive
Flore,Plantes aquatiques submergées,HYDRI,Hydrille verticillé,Hydrilla verticillata,Hydrilla,Hydrilla verticillata,"Élodée dense (<i>Egeria densa</i>), élodée flottante (<i>Egeria najas</i>), élodée du Canada (<i>Elodea canadensis</i>), élodée de Nuttall (<i>Elodea nuttallii</i>) et hippuride vulgaire (<i>Hippuris vulgaris</i>).","Plante vivace submergée et enracinée au substrat, pouvant former des herbiers denses, à des profondeurs de plus de 7 m. Deux types d'hydrille verticillé sont présents aux États-Unis. On trouve le type monoïque dans les États du nord, y compris le Maine, New York, le Connecticut et le Massachusetts. Le type dioïque est généralement présent dans les États du sud, notamment la Floride, la Louisiane et le Texas. Ces deux types ont des caractéristiques morphologiques différentes. ","L'hydrille verticillée a la capacité de s'adapter à un large éventail de conditions environnementales. Il pousse dans différents types de substrats, dans des eaux calmes ou agitées, à des concentrations faibles ou élevées en nutriments. La plante peut supporter des salinités de 10 parties par millier. Elle s'adapte facilement à des luminosités réduites car sa photosynthèse débute tôt le matin, avant celle de la plupart des autres espèces, et se termine tard en fin de journée. Elle pousse bien dans les eaux troubles et peut atteindre des profondeurs de plus de 10 m en eau claire. ","L'hydrille verticillée peut être relâché en milieu naturel par les aquariophiles et les amateurs de jardins d'eau. La plante se propage par fragmentation de la tige et par ses rhizomes, ses turions et ses tubercules qui survivent à l'hiver. Les turions poussent le printemps suivant, alors que les tubercules peuvent demeurer en dormance dans les sédiments pendant plusieurs années. Les tubercules et les turions résistent au gel, à la dessiccation, à l'ingestion par les oiseaux et aux herbicides. Les fragments de tige, les turions et les tubercules peuvent être transportés par les embarcations, les remorques et le matériel.  ",,,"De manière générale, l'espèce se caractérise par des verticilles de 5 feuilles, mais leur nombre peut varier de 4 à 8. Près de la base, les feuilles peuvent être opposées ou en verticilles de 3. Elles sont d'un vert brillant, allongées et leur extrémité est pointue. Leur largeur varie de 1 à 5 mm. Elles n'ont pas de pétiole et elles sont attachées directement sur la tige. La marge des feuilles porte des dents aiguës petites mais visibles à l'oeil nu. Type monoïque : Les feuilles sont délicates et translucides. Elles mesurent en moyenne de 4 à 10 mm de long. Elles ne portent pas de nervure centrale prononcée ni d'épine.Type dioïque : Les feuilles sont robustes et mesurent de 6 à 20 mm de long. Elles ont une nervure centrale prononcée dont la face inférieure peut porter des épines acérées.","Le type monoïque a des fleurs mâles et femelles sur le même plant, alors que le type dioïque a des fleurs mâles et femelles sur des plants différents. Les fleurs femelles sont composées de 3 pétales translucides et de 3 sépales blanchâtres portant des stries rouges et mesurant jusqu'à 4 mm de long. Elles sont attachées à la tige par un pétiole mince et long qui leur permet de rejoindre la surface. Le pétiole peut mesurer jusqu'à 10 cm. Les fleurs mâles sont soit présentes par paires à l'aisselle des feuilles, soit solitaires et portées sur un pétiole court. Les fleurs mâles se détachent sous l'eau à l'état de bourgeons et s'ouvrent lorsqu'elles arrivent à la surface. Leurs pétales et leurs sépales mesurent de 2 à 3 mm de long. Les fleurs mâles sont blanchâtres ou rougeâtres. La floraison se poursuit jusqu'à l'automne. Les populations dioïques observées aux États-Unis sont toutes femelles. ",Les plants monoïques peuvent produire des graines viables. ,"Les tiges sont érigées. Les plants monoïques sont densément ramifiés près de leur base et poussent rapidement vers la surface. Les plants dioïques poussent droit et se ramifient densément près de la surface. Habituellement, l'espace entre les verticilles des feuilles est de la même longueur que ces dernières, mais il peut aussi atteindre 5 cm. Les tiges produisent des turions verts et écailleux à l'aisselle des feuilles. ","Les rhizomes et les stolons produisent des turions brunâtres et lisses. Le système racinaire produit également des tubercules d'aspect écailleux, de couleur crème ou brunâtre, de 5 à 10 mm de long. ",,"['Adaptable', 'Resilient', 'Diligent', 'Persistent', 'Friendly', 'Curious']","[f'Hey! I\'m a chatty plant! Guess you\'d say I\'m... *adaptable*!', 'Woah, you\'re such a diligent one! All this chat and you still find time to photosynthesize, wow!', 'I hear you like to explore, what a curious little thing!', 'You\'re so friendly! But also quite persistent, hehe!']",images/reference/question_mark.jpg,True
Flore,Plantes aquatiques submergées,MYREP,Myriophylle à épis,Myriophyllum spicatum,Eurasian water-milfoil,Myriophyllum spicatum,"Les myriophylles indigènes (<i>Myriophyllum sp.</i>), les utriculaires (<i>Utricularia sp.</i>), la cornifle nageante (<i>Ceratophyllum demersum</i>) et la cornifle échinée (<i>Ceratophyllum echinatum</i>) peuvent être confondus avec le myriophylle à épis. Le myriophylle à épis se distingue par ses feuilles disposées sur la tige en verticilles, normalement en groupes de 4. L'espace entre les verticilles est supérieur à 1 cm. Chaque feuille porte de 12 à 24 paires de folioles (de 3 à 14 paires de folioles dans le cas des myriophylles indigènes). Ainsi, s’il y a plus de 15 paires de 
 folioles par feuille, il s’agit fort probablement du myriophylle à épis. De plus, l’extrémité des feuilles est souvent tronquée, formant une ligne droite. ",Plante submergée ou émergeante enracinée au substrat et formant des herbiers denses. Le myriophylle à épi peut pousser à des profondeurs allant de 1 à 10 m. Il atteint la surface lorsqu'il pousse à des profondeurs de moins de 5 m. ,"Le myriophylle à épis pousse dans une grande variété de conditions et d'habitats. Il pousse dans les lacs, les rivières, les marais et les canaux. La croissance maximale de l'espèce est observée dans les lacs à substrats fertiles et à texture fine, lorsque la luminosité est élevée et que les eaux sont riches en nutriments. ","Le myriophylle à épis se propage rapidement par fragmentation de la tige. Les fragments sont transportés par le courant, les embarcations, les remorques, le matériel et les animaux. La plante produit également des rhizomes qui facilitent la croissance des colonies.    ",,,"Le myriophylle à épis a deux types de feuilles. Les feuilles submergées sont verticillées et subdivisées comme une plume. Les verticilles sont composés de 3 à 6 feuilles; le plus souvent, elles en ont 4. Les feuilles sont composées de 12 à 24 paires de folioles. Certaines feuilles peuvent en avoir 5. Il faut vérifier le nombre de paires de folioles de plusieurs feuilles, à différents endroits sur la tige. L'extrémité des feuilles est fréquemment coupée de manière abrupte et forme une ligne droite. Les feuilles émergeantes sont les bractées et elles sont situées sous les fleurs.","Les fleurs sont disposées en verticilles sur des épis émergeants. Ceux-ci peuvent mesurer entre 5 et 20 cm. Les fleurs mâles et femelles sont respectivement disposées dans le haut et dans le bas de l'épi. Lorsque des pétales sont présents, ils sont au nombre de 4. Les colonies ne fleurissent pas toutes.",Les fruits sont des capsules segmentées renfermant 4 graines.,Les tiges sont minces et se courbent afin de flotter à la surface de l'eau. Elles sont abondamment ramifiées près de la surface. L'espace entre les noeuds est supérieur à 1 cm. Les tiges s'épaississent avant la floraison et sont plus larges vers le fond de l'eau. Les tiges peuvent mourir à la fin de la saison de croissance ou survivre intactes sous la glace. ,Les racines sont denses et étendues. ,,"['Friendly', 'Fertile', 'Adaptable', 'Social', 'Observant', 'Elegant', 'Resilient']","[f""Hey! I'm your friendly Myriophylle!""]

[f""Wow, such a fertile and productive lake! I thrive here, you see.""]

[f""Adaptability is key! Whether it's a river or a marsh, I can make myself at home.""]

[f""Look at my lovely herbier! We're like a big family, all connected.""]

[f""Hey there, I notice you! And with my precise observations, I can tell we're not the same species.""]

[f""I bring elegance wherever I go, with my graceful, floating stems.""]

[f""I'm a resilient one! Don't worry, I'll stick around for a long time.""]",images/reference/myriophyllum_spicatum.jpg,True
Flore,Plantes aquatiques submergées,MYRAQ,Myriophylle aquatique,Myriophyllum aquaticum,Parrot feather,Myriophyllum aquaticum,"Les autres myriophylles, les utriculaires, les cornifles et la cabomba de Caroline (<i>Cabomba caroliniana</i>).","Plante vivace submergée ou émergente, dont la partie émergente ressemble à un petit sapin de couleur vert tendre.","Le myriophylle aquatique pousse dans les lacs, les étangs et les rivières à faible débit, riches en nutriments. Il peut également pousser dans les eaux légèrement salées. Bien qu'il pousse mieux lorsqu'il est enraciné et en eau peu profonde, le myriophylle aquatique peut aussi être observé sous forme flottante en eau profonde. Il pousse bien sur les berges. ",Le myriophylle aquatique peut être libéré dans la nature par les aquariophiles et les amateurs de jardins d'eau. Il peut aussi être propagé d'un plan d'eau à un autre par des fragments attachés aux embarcations et aux équipements. Le myriophylle aquatique se multiplie et se propage par ses rhizomes.,,,"Le myriophylle aquatique a deux types de feuilles d'apparence similaire. Les feuilles submergées sont brunâtres ou rougeâtres. Elles mesurent de 1,5 à 3,5 cm et comportent de 20 à 30 folioles. Elles semblent détériorées et moins développées que les feuilles émergentes. Les feuilles émergentes sont verticillées et disposées par groupes de 4 ou 6. Les verticilles sont espacés à la base de la tige et plus rapprochées près du sommet. Les feuilles émergentes mesurent de 2,5 à 5 cm de long et comportent de 10 à 18 paires de folioles. Leur nervure centrale est aplatie et leur pétiole est court. Les feuilles émergentes sont robustes et ressemblent à des plumes. Elles sont d'une couleur verte vibrante et ont un aspect cireux. ",Les fleurs sont minuscules et rosées. Elles ont 4 sépales blancs et des pétioles courts. Elles apparaissent au printemps à l'aisselle des feuilles émergentes des plants femelles. ,Les plants observés en Amérique du Nord sont tous des femelles et ne produisent pas de graines. Leur reproduction est exclusivement asexuée.,Les tiges peuvent mesurer jusqu'à 2 m de long. Leur portion émergente ne se ramifie pas et peut atteindre 30 cm de hauteur. Le myriophylle aquatique possède également des rhizomes.,Les racines sont fines et abondantes. Elles sont présentes sur les rhizomes.,,"['Vibrant', 'Outgoing', 'Hardworking', 'Adventurous', 'Mysterious']","[""Wow! I'm so vibrant, I light up every conversation!"", ""Look at me, I'm the life of the party! Everybody loves a Parrot Feather, hehe!"", ""Hustle and bustle, that's my motto! I get things done, you know it!"", ""Hey, let's go on an adventure! I hear there's a lake over yonder."", ""Ooh, mysterious flowers, shhh! The secrets they hold...]"">]]",images/reference/question_mark.jpg,True
Flore,Plantes aquatiques submergées,NITET,Nitelle étoilée,Nitellopsis obtusa,Starry stonewort,<i>Nitellopsis obtusa</i>,"La nitelle étoilée peut facilement être confondue avec les algues de la famille des Characées (<i>Chara sp.</i> et <i>Nitella sp.</i>), qui sont très présentes au Québec. Les rameaux de la nitelle étoilée sont cependant beaucoup plus longs que ceux de ces Characées indigènes. Contrairement à la nitelle étoilée, le thalle des <i>Chara sp.</i> aura une apparence rugueuse, car il sera parsemé de petites bosses. Les rameaux des <i>Nitella sp.</i>, quant à eux, seront plus flasques que ceux de la nitelle étoilée, qui conservent leur rigidité lorsque sortis de l’eau.

La nitelle étoilée pourrait aussi, dans une certaine mesure, être confondue avec certains potamots d’allure plus filamenteuse.","La nitelle étoilée est une algue macroscopique. Elle peut se développer jusqu’à une profondeur de 9 m, puisqu’elle tolère bien les habitats avec peu de lumière, et elle peut former de denses tapis au fond de l’eau. Elle peut également persister sous un épais couvert de glace dans certains lacs.

L’espèce est originaire d’Eurasie et elle semble être de plus en plus présente dans la région des Grands Lacs (notamment dans le lac Ontario) et du nord-est des États-Unis. Elle est d’ailleurs présente au Vermont, dans la partie américaine du lac Memphrémagog.",La nitelle étoilée est un organisme d’eau douce qui peut également tolérer l’eau salée. Elle préfère les eaux riches en calcium ou en magnésium (eaux dures) et elle s’attache aux sédiments des eaux calmes des étangs et des lacs.,"Il existe chez la nitelle étoilée des individus mâles et femelles qui produisent chacun des organes reproductifs distincts. Cependant, seuls des mâles ou des individus stériles ont été observés jusqu’à présent en Amérique du Nord. La nitelle étoilée se propage donc grâce aux bulbilles ou aux segments du thalle qui se détachent et qui peuvent tous deux former de nouveaux individus.",,,,"Les bulbilles blanches en forme d’étoiles peuvent être confondues avec des fleurs. Ces bulbilles, qui mesurent moins de 5 mm de diamètre, peuvent être observées sur les rhizoïdes ou sur les nœuds du thalle à l’automne.",,"La nitelle étoilée ne possède pas de tige, mais plutôt un thalle (corps végétatif), qui est généralement lisse et d’un vert vif à brunâtre. Le thalle comporte plusieurs segments de longueur variable qui peuvent mesurer jusqu’à 20 cm. Ces segments sont séparés par des nœuds où l’algue se ramifie en rameaux (de cinq à sept). C’est sur ces nœuds qu’on retrouve les organes reproducteurs (mâles ou femelles) de la nitelle étoilée. Chaque rameau peut à son tour se diviser, ce qui donne des allures de pointes fourchues inégales.","Contrairement aux plantes vasculaires aquatiques, les algues ne possèdent pas de système racinaire. Pour s’accrocher aux sédiments, la nitelle étoilée utilise des rhizoïdes translucides.",,"['Assertive', 'Patient', 'Particular', 'Striking', 'Adaptable']","[f'Hey! I\'m a Starry stonewort, a super patient plant. Don\'t mess with me, I know what I like!',
 'Woah, that fish is a real magnes-buddy of mine!',
 'I might look sharp, but I\'m really just a big softy!',
 'Hey, hey, slow down! I\'m particular about my company!',
 'Adapt or bust! That\'s my motto, buddy.']",images/reference/question_mark.jpg,True
Flore,Plantes aquatiques submergées,PETNA,Petite naïade,Najas minor,Brittle-leaved naid,Najas minor,"Naïade flexible (<i>Najas flexilis</i>) et autres naïades, les espèces de potamots à feuilles étroites et les algues Chara sp. et Nitella sp. La petite naïade se distingue par ses feuilles qui sont recourbées (à la fin de l'été) et qui portent à la marge des dents visibles à l'œil nu.",La petite naïade est une plante annuelle submergée qui peut atteindre des profondeurs de plus de 5 m. Elle pousse en sous-étage et peut être difficile à détecter.,"La petite naïade peut coloniser les étangs, les lacs, les rivières et les ruisseaux à écoulement lent. Elle préfère le sable et le gravier mais peut se développer dans une diversité de substrats. Elle pousse bien dans des eaux alcalines mais tolère les eaux turbides et eutrophes. ",La petite naïade produit des graines en abondance et c'est ce qui lui permet de se reproduire et de se propager. Les graines sont disséminées par l'eau et probablement de la sauvagine lorsqu'elle se nourrit de la plante. La fragmentation des tiges peut faciliter le transport des graines qui restent attachées aux tiges. Les fragments peuvent flotter ou s'accrocher aux embarcations et au matériel.,Non,,"La disposition des feuilles est variable. Celles-ci peuvent être opposées, subopposées, verticillées ou en touffes. Petites et minces, les feuilles mesurent rarement plus de 3,5 cm de long et de 1 mm de large. Elles sont linéaires ou lancéolées et se recourbent à partir du mois d'août. La marge des feuilles est ornée de dents qui sont visibles à l'oeil nu. Les feuilles embrassent la tige et, lorsqu'elles sont arrachées, il est possible d'observer leur base carrée, proéminente et qui se décline abruptement.",Les fleurs sont monoïques et formées à l'aisselle des feuilles. Elles sont petites et discrètes. ,"Les graines sont violacées et mesurent de 1,5 à 3,0 mm de long. Elles sont en forme de broche légèrement courbée et portent des échancrures rectangulaires disposées en rangs longitudinaux. Les graines se forment à l'aisselle des feuilles de juillet à septembre. Elles s'accumulent dans les sédiments. ","Les tiges sont fines et peuvent atteindre 1,2 m de long. Elles sont abondamment ramifiées près de la surface. Elles se fragmentent aisément, surtout à la fin de l'été et au début de l'automne.",Les jeunes pousses se développent à partir de fines racines qui s'enracinent peu profondément dans les sédiments. ,,"['Subtle Naïade', 'Delicate', 'Adaptable', 'Social Observer', 'Whispering Nature']","[f'Well, hey there! I''m Najas minor, your friendly neighborhood plant. Don''t worry; I''m just a quiet and Subtle Naïade.',
'Wow, that''s a great question! I''m not too confident, so I''ll have a think about it and get back to you on that one.',
'Hey, have you seen my leaves? They''re pretty delicate and curvy, you know. Kind of like a gentle spiral!',
'I''m a pretty adaptable plant pal! I can hang out in all sorts of places, as long as there''s some sandy soil and water.',
'There''s so much chatter going on! I''m just gonna stand over here and observe. You know, being a Social Observer and all.',
'Why, hello there, birdies! You look like you have some questions for me, those beaks are quite curious. I''ll do my best to whisper some answers!']",images/reference/question_mark.jpg,True
Flore,Plantes aquatiques submergées,POTAM,Potamot crépu,Potamogeton crispus,Curly-leaved pondweed,Potamogeton crispus,"Le potamot crépu est le seul potamot dont les feuilles ont une marge dentelée et ondulée comme une pâte à lasagne. Certains potamots (ex. <i>Potamogeton richardsonii</i>, <i>P. praelongus</i> et <i>P. perfoliatus</i>) peuvent avoir des feuilles ondulées, mais leur marge ne porte pas de petites dents.","Le potamot crépu est une plante vivace submergée. Ses plants germent à partir de rhizomes et de turions à l'automne et poussent l'hiver sous la glace, atteignant leur maturité au printemps ou au début de l'été. ","Le potamot crépu préfère les substrats meubles et les eaux alcalines et riches en nutriments. Il tolère les eaux calmes ou courantes, une faible transparence et des températures fraîches. La plante peut croître à l'ombre, dans des eaux polluées ou turbides où plusieurs plantes indigènes ne peuvent pousser. ","La propagation est faite par les graines ou facilitée par les turions qui sont transportés par le courant, par l'équipement de pêche ou par les embarcations. ",Oui,,"Les feuilles sont oblongues, alternes et sessiles. Elles sont légèrement translucides et leur couleur varie de vert olive à brun rougeâtre. Elles mesurent de 4 à 10 cm de long et de 5 à 10 mm de large. Leur marge est distinctement ondulée comme une pâte à lasagne et comporte de petites dents visibles à l'oeil nu. Les stipules mesurent de 4 à 10 mm de long et sont délicatement jointes à la tige à la base des feuilles. Elles se désagrègent tôt durant la saison de croissance. Les feuilles ont un patron veineux particulier qui ressemble à un vitrail composé de deux colonnes, séparées par une nervure centrale et entourées par un cadre, formant 3 veines principales. Le potamot crépu n'a pas de feuilles flottantes. Le feuillage hivernal est plus étroit, aplati, de couleur bleu-vert. Il est plus souple et plus translucide que le feuillage d'été.  ",Les fleurs sont disposées en épi émergeant de 1 à 3 cm. Le pétiole de l'épi est mince et parfois courbé. Il peut mesurer jusqu'à 7 cm de long. Les fleurs sont petites et ont 4 lobes ressemblant à des pétales. La floraison a lieu de juin à septembre.,Les fruits portent un bec proéminent en forme de cône et une arête cahoteuse qui ressemble à une couronne.,"Les tiges sont légèrement aplaties et de couleur brun rougeâtre. Elles peuvent atteindre plusieurs mètres de long et sont ramifiées, ce qui donne un aspect touffu à la plante. Les tiges sont formées à partir de rhizomes et de turions qui sont des bourgeons végétatifs formés au printemps et qui germent à l'automne. Les turions sont durs mais flexibles et ils ont la texture du plastique rigide. Ils mesurent de 1 à 2 cm de long et sont portés sur de courtes branches le long de la tige. ",Les racines sont fibreuses et partent des rhizomes.,,"['Reserved', 'Enduring', 'Adaptable', 'Distinctive', 'Hardworking', 'Late Bloomer', 'Unassuming']","[f'Oh, hey there! I\'m Curly, the shy guy in the corner.', 'Wow, you\'re a great listener! I really thrive on that.', 'Adapt to new waters? Easy peasy! Just give me a moment to get used to it.', 'My leaves are so wavy! They say hi.', 'I\'m a hard worker, you know. I just take my time.', 'You won\'t believe I mature so late. It\'s kinda my thing!']",images/reference/potamogeton_crispus.jpg,True
Flore,Plantes de milieux terrestres,ALLIA,Alliaire officinale,Alliaria petiolata,Garlic mustard,Alliaria petiolata,"Violette (<i>Viola</i> sp.), benoîte (<i>Geum</i> sp.).","Plante biannuelle dont les jeunes feuilles libèrent une forte odeur d'ail lorsqu'elles sont froissées. À sa deuxième année de croissance, l'alliaire officinale peut atteindre une hauteur variant de 0,3 à 1,2 m et former de grandes colonies monospécifiques.","L'alliaire officinale pousse dans les sols humides des plaines inondables ombragées, dans les forêts, en bordure des routes, le long des sentiers, dans les trouées forestières et dans les milieux perturbés. La plante ne tolère pas les sols très acides. ","La plante est propagée par ses graines, le long des sentiers, par les cours d'eau et par les activités humaines. ",,,"Lors de sa première année de croissance, la plante produit une rosette de feuilles vert foncé en forme de rein, dont les bords sont dentelés. Elles peuvent mesurer de 2 à 12 cm de diamètre et leur pétiole est pubescent. Elles demeurent vertes l'hiver. Les feuilles produites lors de la deuxième année de croissance sont triangulaires, alternes et fortement dentelées. Les feuilles du bas du plant sont larges, ont une forme de rein et peuvent mesurer jusqu'à 10 cm de large. Elles deviennent plus étroites vers le sommet du plant.  ",Les fleurs sont produites lors de la deuxième année de croissance. Elles sont composées de 4 pétales blancs de 4 mm disposés en croix. La floraison a lieu en mai.,"Les graines sont noires et oblongues. Elles sont produites dans une structure qui ressemble à une capsule appelée « silique », qui a quatre côtés et une cloison transversale, et qui mesure entre 2,5 et 6 cm de long et 2 mm de large. Chaque plant mature peut produire entre 130 et 300 graines. Les graines demeurent viables de 2 à 4 ans. Les graines sont brunâtres ou noirâtres, cylindriques ou ellipsoïdales. Elles mesurent 3 mm de long par 1 mm de large. Elles portent une crête à leur extrémité. Les graines sont produites de la fin de juin jusqu'au mois d'août.",Les tiges sont simples ou ramifiées. ,La racine principale est pivotante. Elle a une courbe en forme de « s » près de la surface du sol.,,"['Assertive', 'Confident', 'Tall', 'Adaptable', 'Mysterious', 'Independent']","[f'Hey! I\'m {name} the mighty Alliaire. Smell my garlic breath!', 'Wow, look at me grow! I reach up to the sky, oh yeah!', 'Adapt to survive, that\'s my motto! Hey, roll with the punches!', 'I got the looks and the smell, a mysterious combo!', 'Don\'t need no company, I\'m a cool customer, yeah!']",images/reference/alliaria_petiolata.jpg,True
